{
  "cases": [
    {
      "arguments": [
        "src",
        "--output-filename",
        "out.info",
        "--ignore-errors",
        "source,unsupported"
      ],
      "command": "geninfo",
      "comparisons": [
        {
          "dimension": "exit",
          "normalizer": "exact-v1"
        },
        {
          "dimension": "filesystem",
          "normalizer": "exact-v1"
        }
      ],
      "fixture": "compat/fixtures/m0-cli-hard-residual-contract",
      "id": "m0-cli-hard-residual-contract-geninfo-control",
      "surface": "cli"
    },
    {
      "arguments": [
        "src",
        "--large-file",
        "(",
        "--output-filename",
        "out.info",
        "--ignore-errors",
        "source,unsupported"
      ],
      "command": "geninfo",
      "comparisons": [
        {
          "dimension": "exit",
          "normalizer": "exact-v1"
        },
        {
          "dimension": "filesystem",
          "normalizer": "exact-v1"
        }
      ],
      "fixture": "compat/fixtures/m0-cli-hard-residual-contract",
      "id": "m0-cli-hard-residual-contract-geninfo-large-file-invalid",
      "surface": "cli"
    },
    {
      "arguments": [
        "--capture",
        "--directory",
        "src",
        "--output-file",
        "out.info",
        "--ignore-errors",
        "source,unsupported"
      ],
      "command": "lcov",
      "comparisons": [
        {
          "dimension": "exit",
          "normalizer": "exact-v1"
        },
        {
          "dimension": "filesystem",
          "normalizer": "exact-v1"
        }
      ],
      "fixture": "compat/fixtures/m0-cli-hard-residual-contract",
      "id": "m0-cli-hard-residual-contract-lcov-control",
      "surface": "cli"
    },
    {
      "arguments": [
        "--capture",
        "--directory",
        "src",
        "--large-file",
        "(",
        "--output-file",
        "out.info",
        "--ignore-errors",
        "source,unsupported"
      ],
      "command": "lcov",
      "comparisons": [
        {
          "dimension": "exit",
          "normalizer": "exact-v1"
        },
        {
          "dimension": "filesystem",
          "normalizer": "exact-v1"
        }
      ],
      "fixture": "compat/fixtures/m0-cli-hard-residual-contract",
      "id": "m0-cli-hard-residual-contract-lcov-large-file-invalid",
      "surface": "cli"
    },
    {
      "arguments": [
        "src",
        "--output-filename",
        "out.info",
        "--ignore-errors",
        "source,unsupported"
      ],
      "command": "geninfo",
      "comparisons": [
        {
          "dimension": "exit",
          "normalizer": "exact-v1"
        },
        {
          "dimension": "stderr",
          "normalizer": "exact-v1"
        },
        {
          "dimension": "filesystem",
          "normalizer": "exact-v1"
        }
      ],
      "fixture": "compat/fixtures/m0-cli-hard-residual-contract",
      "id": "m0-cli-hard-residual-contract-geninfo-debug-control",
      "surface": "cli"
    },
    {
      "arguments": [
        "src",
        "--debug",
        "--output-filename",
        "out.info",
        "--ignore-errors",
        "source,unsupported"
      ],
      "command": "geninfo",
      "comparisons": [
        {
          "dimension": "exit",
          "normalizer": "exact-v1"
        },
        {
          "dimension": "stderr",
          "normalizer": "exact-v1"
        },
        {
          "dimension": "filesystem",
          "normalizer": "exact-v1"
        }
      ],
      "fixture": "compat/fixtures/m0-cli-hard-residual-contract",
      "id": "m0-cli-hard-residual-contract-geninfo-debug",
      "surface": "cli"
    }
  ],
  "evidence_scope": "compatibility",
  "schema_version": 1,
  "suite_id": "m0-cli-hard-residual-contract"
}
