{
  "cases": [
    {
      "arguments": [
        "--summary",
        "trace.info"
      ],
      "command": "lcov",
      "comparisons": [
        {
          "dimension": "exit",
          "normalizer": "exact-v1"
        },
        {
          "dimension": "stdout",
          "normalizer": "exact-v1"
        },
        {
          "dimension": "stderr",
          "normalizer": "exact-v1"
        },
        {
          "dimension": "filesystem",
          "normalizer": "exact-v1"
        }
      ],
      "fixture": "compat/fixtures/m0-config-contract/lcov-home",
      "id": "m0-config-lcov-home-fallback",
      "surface": "config"
    }
  ],
  "evidence_scope": "compatibility",
  "schema_version": 1,
  "suite_id": "m0-config-contract-lcov-home"
}
