{
  "cases": [
    {
      "arguments": [
        "--config-file",
        "control.lcovrc",
        "--output-directory",
        "report",
        "input.info"
      ],
      "command": "genhtml",
      "comparisons": [
        {
          "dimension": "exit",
          "normalizer": "exact-v1"
        },
        {
          "dimension": "filesystem",
          "normalizer": "exact-v1"
        }
      ],
      "fixture": "compat/fixtures/m0-lcovrc-genhtml-residual2-contract",
      "id": "m0-lcovrc-genhtml-residual2-contract-control",
      "surface": "config"
    },
    {
      "arguments": [
        "--config-file",
        "dark-mode.lcovrc",
        "--output-directory",
        "report",
        "input.info"
      ],
      "command": "genhtml",
      "comparisons": [
        {
          "dimension": "exit",
          "normalizer": "exact-v1"
        },
        {
          "dimension": "filesystem",
          "normalizer": "exact-v1"
        }
      ],
      "fixture": "compat/fixtures/m0-lcovrc-genhtml-residual2-contract",
      "id": "m0-lcovrc-genhtml-residual2-contract-dark-mode",
      "surface": "config"
    },
    {
      "arguments": [
        "--config-file",
        "flat-view.lcovrc",
        "--output-directory",
        "report",
        "input.info"
      ],
      "command": "genhtml",
      "comparisons": [
        {
          "dimension": "exit",
          "normalizer": "exact-v1"
        },
        {
          "dimension": "filesystem",
          "normalizer": "exact-v1"
        }
      ],
      "fixture": "compat/fixtures/m0-lcovrc-genhtml-residual2-contract",
      "id": "m0-lcovrc-genhtml-residual2-contract-flat-view",
      "surface": "config"
    },
    {
      "arguments": [
        "--config-file",
        "frames.lcovrc",
        "--output-directory",
        "report",
        "input.info"
      ],
      "command": "genhtml",
      "comparisons": [
        {
          "dimension": "exit",
          "normalizer": "exact-v1"
        },
        {
          "dimension": "filesystem",
          "normalizer": "exact-v1"
        }
      ],
      "fixture": "compat/fixtures/m0-lcovrc-genhtml-residual2-contract",
      "id": "m0-lcovrc-genhtml-residual2-contract-frames",
      "surface": "config"
    },
    {
      "arguments": [
        "--config-file",
        "footer.lcovrc",
        "--output-directory",
        "report",
        "input.info"
      ],
      "command": "genhtml",
      "comparisons": [
        {
          "dimension": "exit",
          "normalizer": "exact-v1"
        },
        {
          "dimension": "filesystem",
          "normalizer": "exact-v1"
        }
      ],
      "fixture": "compat/fixtures/m0-lcovrc-genhtml-residual2-contract",
      "id": "m0-lcovrc-genhtml-residual2-contract-footer",
      "surface": "config"
    },
    {
      "arguments": [
        "--config-file",
        "charset.lcovrc",
        "--output-directory",
        "report",
        "input.info"
      ],
      "command": "genhtml",
      "comparisons": [
        {
          "dimension": "exit",
          "normalizer": "exact-v1"
        },
        {
          "dimension": "filesystem",
          "normalizer": "exact-v1"
        }
      ],
      "fixture": "compat/fixtures/m0-lcovrc-genhtml-residual2-contract",
      "id": "m0-lcovrc-genhtml-residual2-contract-charset",
      "surface": "config"
    },
    {
      "arguments": [
        "--config-file",
        "desc-html.lcovrc",
        "--output-directory",
        "report",
        "input.info"
      ],
      "command": "genhtml",
      "comparisons": [
        {
          "dimension": "exit",
          "normalizer": "exact-v1"
        },
        {
          "dimension": "filesystem",
          "normalizer": "exact-v1"
        }
      ],
      "fixture": "compat/fixtures/m0-lcovrc-genhtml-residual2-contract",
      "id": "m0-lcovrc-genhtml-residual2-contract-desc-html",
      "surface": "config"
    },
    {
      "arguments": [
        "--config-file",
        "keep-descriptions.lcovrc",
        "--output-directory",
        "report",
        "input.info"
      ],
      "command": "genhtml",
      "comparisons": [
        {
          "dimension": "exit",
          "normalizer": "exact-v1"
        },
        {
          "dimension": "filesystem",
          "normalizer": "exact-v1"
        }
      ],
      "fixture": "compat/fixtures/m0-lcovrc-genhtml-residual2-contract",
      "id": "m0-lcovrc-genhtml-residual2-contract-keep-descriptions",
      "surface": "config"
    },
    {
      "arguments": [
        "--config-file",
        "synthesize-missing.lcovrc",
        "--output-directory",
        "report",
        "input.info"
      ],
      "command": "genhtml",
      "comparisons": [
        {
          "dimension": "exit",
          "normalizer": "exact-v1"
        },
        {
          "dimension": "filesystem",
          "normalizer": "exact-v1"
        }
      ],
      "fixture": "compat/fixtures/m0-lcovrc-genhtml-residual2-contract",
      "id": "m0-lcovrc-genhtml-residual2-contract-synthesize-missing",
      "surface": "config"
    },
    {
      "arguments": [
        "--config-file",
        "show-noncode-owners.lcovrc",
        "--output-directory",
        "report",
        "input.info"
      ],
      "command": "genhtml",
      "comparisons": [
        {
          "dimension": "exit",
          "normalizer": "exact-v1"
        },
        {
          "dimension": "filesystem",
          "normalizer": "exact-v1"
        }
      ],
      "fixture": "compat/fixtures/m0-lcovrc-genhtml-residual2-contract",
      "id": "m0-lcovrc-genhtml-residual2-contract-show-noncode-owners",
      "surface": "config"
    },
    {
      "arguments": [
        "--config-file",
        "show-function-proportion.lcovrc",
        "--output-directory",
        "report",
        "input.info"
      ],
      "command": "genhtml",
      "comparisons": [
        {
          "dimension": "exit",
          "normalizer": "exact-v1"
        },
        {
          "dimension": "filesystem",
          "normalizer": "exact-v1"
        }
      ],
      "fixture": "compat/fixtures/m0-lcovrc-genhtml-residual2-contract",
      "id": "m0-lcovrc-genhtml-residual2-contract-show-function-proportion",
      "surface": "config"
    },
    {
      "arguments": [
        "--config-file",
        "nav-resolution.lcovrc",
        "--output-directory",
        "report",
        "input.info"
      ],
      "command": "genhtml",
      "comparisons": [
        {
          "dimension": "exit",
          "normalizer": "exact-v1"
        },
        {
          "dimension": "filesystem",
          "normalizer": "exact-v1"
        }
      ],
      "fixture": "compat/fixtures/m0-lcovrc-genhtml-residual2-contract",
      "id": "m0-lcovrc-genhtml-residual2-contract-nav-resolution",
      "surface": "config"
    },
    {
      "arguments": [
        "--config-file",
        "nav-offset.lcovrc",
        "--output-directory",
        "report",
        "input.info"
      ],
      "command": "genhtml",
      "comparisons": [
        {
          "dimension": "exit",
          "normalizer": "exact-v1"
        },
        {
          "dimension": "filesystem",
          "normalizer": "exact-v1"
        }
      ],
      "fixture": "compat/fixtures/m0-lcovrc-genhtml-residual2-contract",
      "id": "m0-lcovrc-genhtml-residual2-contract-nav-offset",
      "surface": "config"
    },
    {
      "arguments": [
        "--config-file",
        "age-field-width.lcovrc",
        "--output-directory",
        "report",
        "input.info"
      ],
      "command": "genhtml",
      "comparisons": [
        {
          "dimension": "exit",
          "normalizer": "exact-v1"
        },
        {
          "dimension": "filesystem",
          "normalizer": "exact-v1"
        }
      ],
      "fixture": "compat/fixtures/m0-lcovrc-genhtml-residual2-contract",
      "id": "m0-lcovrc-genhtml-residual2-contract-age-field-width",
      "surface": "config"
    },
    {
      "arguments": [
        "--config-file",
        "owner-field-width.lcovrc",
        "--output-directory",
        "report",
        "input.info"
      ],
      "command": "genhtml",
      "comparisons": [
        {
          "dimension": "exit",
          "normalizer": "exact-v1"
        },
        {
          "dimension": "filesystem",
          "normalizer": "exact-v1"
        }
      ],
      "fixture": "compat/fixtures/m0-lcovrc-genhtml-residual2-contract",
      "id": "m0-lcovrc-genhtml-residual2-contract-owner-field-width",
      "surface": "config"
    },
    {
      "arguments": [
        "--config-file",
        "date-labels.lcovrc",
        "--output-directory",
        "report",
        "input.info"
      ],
      "command": "genhtml",
      "comparisons": [
        {
          "dimension": "exit",
          "normalizer": "exact-v1"
        },
        {
          "dimension": "filesystem",
          "normalizer": "exact-v1"
        }
      ],
      "fixture": "compat/fixtures/m0-lcovrc-genhtml-residual2-contract",
      "id": "m0-lcovrc-genhtml-residual2-contract-date-labels",
      "surface": "config"
    }
  ],
  "evidence_scope": "compatibility",
  "schema_version": 1,
  "suite_id": "m0-lcovrc-genhtml-residual2-contract"
}
