{
  "schema_version": 1,
  "suite_id": "m0-lcovrc-genhtml-report-context-contract",
  "evidence_scope": "compatibility",
  "cases": [
    {
      "id": "m0-lcovrc-genhtml-report-context-control",
      "surface": "config",
      "command": "genhtml",
      "arguments": [
        "--config-file",
        "context-0.lcovrc",
        "--baseline-file",
        "baseline.info",
        "--baseline-date",
        "2000-01-01",
        "--diff-file",
        "diff.txt",
        "--select-script",
        "select.pm",
        "--output-directory",
        "report",
        "current.info"
      ],
      "fixture": "compat/fixtures/m0-lcovrc-genhtml-report-context-contract",
      "comparisons": [
        {
          "dimension": "exit",
          "normalizer": "exact-v1"
        },
        {
          "dimension": "stdout",
          "normalizer": "exact-v1"
        },
        {
          "dimension": "stderr",
          "normalizer": "exact-v1"
        },
        {
          "dimension": "filesystem",
          "normalizer": "exact-v1"
        }
      ]
    },
    {
      "id": "m0-lcovrc-genhtml-report-context-num-context-lines",
      "surface": "config",
      "command": "genhtml",
      "arguments": [
        "--config-file",
        "context-5.lcovrc",
        "--baseline-file",
        "baseline.info",
        "--baseline-date",
        "2000-01-01",
        "--diff-file",
        "diff.txt",
        "--select-script",
        "select.pm",
        "--output-directory",
        "report",
        "current.info"
      ],
      "fixture": "compat/fixtures/m0-lcovrc-genhtml-report-context-contract",
      "comparisons": [
        {
          "dimension": "exit",
          "normalizer": "exact-v1"
        },
        {
          "dimension": "stdout",
          "normalizer": "exact-v1"
        },
        {
          "dimension": "stderr",
          "normalizer": "exact-v1"
        },
        {
          "dimension": "filesystem",
          "normalizer": "exact-v1"
        }
      ]
    }
  ]
}
